{
  "schema": "pad-unit-plan",
  "version": "0.1-draft",
  "exportedAt": "2026-10-06T19:25:05.617Z",
  "generator": "PAD (padufs.netlify.app)",
  "units": "metres",
  "coordinateSystem": {
    "origin": "the outer face of the unit’s left wall at the window wall",
    "xAxis": "to the right",
    "yAxis": "down the page, from the window wall (y=0) toward the corridor (y=depth)",
    "toDxf": "x′ = x, y′ = depth − y; a rotation of r degrees clockwise becomes −r in DXF",
    "depth": 9.67,
    "width": 6.59
  },
  "project": {
    "name": "Ninth Line",
    "shape": "U",
    "wing": {
      "name": "West wing",
      "index": 1,
      "of": 3,
      "heading": 0
    }
  },
  "plan": {
    "id": "PAD-01-v1",
    "name": "PAD-01",
    "brief": null,
    "unitType": "1 BED",
    "bedrooms": 1,
    "corner": null,
    "variation": {
      "version": 1,
      "name": "Original layout",
      "savedAt": null,
      "isOriginal": true
    },
    "source": {
      "catalogId": "A1-4.1_1",
      "catalogName": "A1-4.1 · 1 bed + den, 1 bath",
      "printedNetFt2": 547
    },
    "areas": {
      "netM2": 50.82,
      "netFt2": 547,
      "unitGrossM2": 59.216,
      "corridorShareM2": 5.272,
      "grossWithCorridorM2": 64.488,
      "grossWithCorridorFt2": 694,
      "efficiencyPct": 78.806,
      "footprintM2": 63.725,
      "basis": "net: sum of PAD room areas less area taken by bump-ins; unit gross: to wall centrelines; plus half of a 1.6 m shared corridor"
    },
    "footprint": {
      "width": 6.59,
      "depth": 9.67
    }
  },
  "layerMap": {
    "wallSolid": "A-WALL",
    "wallHatch": "A-WALL-PATT",
    "window": "A-GLAZ",
    "doorSwing": "A-DETL-GENF",
    "doorSliding": "A-DOOR-HDLN",
    "roomOutline": "A-AREA",
    "roomLabel": "A-AREA-IDEN",
    "floor": "A-FLOR",
    "furniture": "I-FURN",
    "fixtures": "P-SANR-FIXT",
    "casework": "Q-CASE",
    "casework2d": "Q-CASE-HDLN",
    "appliances": "Q-SPCQ",
    "dimensions": "A-ANNO-DIMS",
    "unitNote": "A-DETL-IDEN"
  },
  "rooms": [
    {
      "id": "R1",
      "name": "Den",
      "tag": "DEN",
      "tagMatchesRevit": true,
      "polygon": [
        [
          4.6,
          7
        ],
        [
          4.7,
          7
        ],
        [
          4.7,
          7.1
        ],
        [
          6.25,
          7.1
        ],
        [
          6.25,
          9.45
        ],
        [
          3.45,
          9.45
        ],
        [
          3.45,
          8.35
        ],
        [
          3.4,
          8.35
        ],
        [
          3.4,
          7.95
        ],
        [
          3.5,
          7.95
        ],
        [
          3.5,
          7.9
        ],
        [
          4.5,
          7.9
        ],
        [
          4.5,
          7.1
        ],
        [
          4.6,
          7.1
        ]
      ],
      "holes": [],
      "areaM2": 6.69,
      "areaSF": 72,
      "polygonAreaM2": 5.767,
      "areaNote": "PAD area differs from the polygon: PAD takes the printed area of the source plan, and the polygon is traced from the room rectangle with smaller rooms cut out",
      "labelPoint": [
        4.93,
        8.23
      ],
      "layers": {
        "outline": "A-AREA",
        "label": "A-AREA-IDEN"
      }
    },
    {
      "id": "R2",
      "name": "Bath",
      "tag": "W/C",
      "tagMatchesRevit": true,
      "polygon": [
        [
          2.5,
          4
        ],
        [
          3.4,
          4
        ],
        [
          3.4,
          4.6
        ],
        [
          3.6,
          4.6
        ],
        [
          3.6,
          4
        ],
        [
          4.6,
          4
        ],
        [
          4.6,
          4.05
        ],
        [
          4.7,
          4.05
        ],
        [
          4.7,
          4.15
        ],
        [
          4.6,
          4.15
        ],
        [
          4.6,
          4.7
        ],
        [
          4.75,
          4.7
        ],
        [
          4.75,
          4.15
        ],
        [
          6.25,
          4.15
        ],
        [
          6.25,
          6.95
        ],
        [
          4.75,
          6.95
        ],
        [
          4.75,
          6.05
        ],
        [
          4.6,
          6.05
        ],
        [
          4.6,
          5.9
        ],
        [
          4.5,
          5.9
        ],
        [
          4.5,
          5.7
        ],
        [
          3.8,
          5.7
        ],
        [
          3.8,
          5.05
        ],
        [
          3.55,
          5.05
        ],
        [
          3.55,
          5.7
        ],
        [
          2.45,
          5.7
        ],
        [
          2.45,
          4.2
        ],
        [
          2.5,
          4.2
        ]
      ],
      "holes": [
        [
          [
            3.75,
            4.65
          ],
          [
            3.75,
            4.85
          ],
          [
            4.55,
            4.85
          ],
          [
            4.55,
            4.65
          ]
        ]
      ],
      "areaM2": 5.39,
      "areaSF": 58,
      "polygonAreaM2": 7.635,
      "areaNote": "PAD area differs from the polygon: PAD takes the printed area of the source plan, and the polygon is traced from the room rectangle with smaller rooms cut out",
      "labelPoint": [
        4.965,
        5.096
      ],
      "layers": {
        "outline": "A-AREA",
        "label": "A-AREA-IDEN"
      }
    },
    {
      "id": "R3",
      "name": "Bedroom",
      "tag": "BEDROOM",
      "tagMatchesRevit": true,
      "polygon": [
        [
          5.8,
          0.3
        ],
        [
          6.5,
          0.3
        ],
        [
          6.5,
          0.35
        ],
        [
          6.3,
          0.35
        ],
        [
          6.3,
          1.25
        ],
        [
          6.25,
          1.25
        ],
        [
          6.25,
          4
        ],
        [
          6.2,
          4
        ],
        [
          6.2,
          3.3
        ],
        [
          4.8,
          3.3
        ],
        [
          4.8,
          4
        ],
        [
          4.7,
          4
        ],
        [
          4.7,
          3.4
        ],
        [
          4.6,
          3.4
        ],
        [
          4.6,
          4
        ],
        [
          3.6,
          4
        ],
        [
          3.6,
          3.8
        ],
        [
          3.4,
          3.8
        ],
        [
          3.4,
          4
        ],
        [
          3.1,
          4
        ],
        [
          3.1,
          1.35
        ],
        [
          3.65,
          1.35
        ],
        [
          3.65,
          0.4
        ],
        [
          5.8,
          0.4
        ]
      ],
      "holes": [
        [
          [
            3.35,
            1.45
          ],
          [
            3.35,
            3.75
          ],
          [
            3.5,
            3.75
          ],
          [
            3.5,
            1.45
          ]
        ]
      ],
      "areaM2": 9.94,
      "areaSF": 107,
      "polygonAreaM2": 9.495,
      "areaNote": "PAD area differs from the polygon: PAD takes the printed area of the source plan, and the polygon is traced from the room rectangle with smaller rooms cut out",
      "labelPoint": [
        4.589,
        2.769
      ],
      "layers": {
        "outline": "A-AREA",
        "label": "A-AREA-IDEN"
      }
    },
    {
      "id": "R4",
      "name": "Living",
      "tag": "LIVING",
      "tagMatchesRevit": true,
      "polygon": [
        [
          1,
          1.2
        ],
        [
          2.8,
          1.2
        ],
        [
          2.8,
          1.35
        ],
        [
          3.1,
          1.35
        ],
        [
          3.1,
          4
        ],
        [
          2.5,
          4
        ],
        [
          2.5,
          4.2
        ],
        [
          2.4,
          4.2
        ],
        [
          2.4,
          4
        ],
        [
          0.4,
          4
        ],
        [
          0.4,
          4.2
        ],
        [
          0.35,
          4.2
        ],
        [
          0.35,
          1.45
        ],
        [
          0.3,
          1.45
        ],
        [
          0.3,
          1.4
        ],
        [
          0.2,
          1.4
        ],
        [
          0.2,
          1.35
        ],
        [
          1,
          1.35
        ]
      ],
      "holes": [],
      "extraParts": [
        [
          [
            0,
            0.3
          ],
          [
            0.05,
            0.3
          ],
          [
            0.05,
            4.45
          ],
          [
            0,
            4.45
          ]
        ],
        [
          [
            0.1,
            0.3
          ],
          [
            0.8,
            0.3
          ],
          [
            0.8,
            0.35
          ],
          [
            0.2,
            0.35
          ],
          [
            0.2,
            1.25
          ],
          [
            0.1,
            1.25
          ]
        ]
      ],
      "areaM2": 11.61,
      "areaSF": 125,
      "polygonAreaM2": 7.597,
      "areaNote": "PAD area differs from the polygon: PAD takes the printed area of the source plan, and the polygon is traced from the room rectangle with smaller rooms cut out",
      "labelPoint": [
        1.8,
        1.96
      ],
      "layers": {
        "outline": "A-AREA",
        "label": "A-AREA-IDEN"
      }
    },
    {
      "id": "R5",
      "name": "Kitchen",
      "tag": "KITCHEN",
      "tagMatchesRevit": true,
      "polygon": [
        [
          0.4,
          4
        ],
        [
          2.4,
          4
        ],
        [
          2.4,
          4.2
        ],
        [
          2.45,
          4.2
        ],
        [
          2.45,
          5.65
        ],